{
  "$schema": "http://json-schema.org/draft-07/schema#",
  "title": "Daily Plan",
  "description": "Pre-market plan written by the Claude Routine. Consumed by main.py at bot startup.",
  "type": "object",
  "required": ["date", "version", "watchlist"],
  "additionalProperties": false,
  "properties": {
    "date": {
      "type": "string",
      "description": "Trading date this plan applies to, YYYY-MM-DD (IST).",
      "pattern": "^[0-9]{4}-[0-9]{2}-[0-9]{2}$"
    },
    "version": {
      "type": "integer",
      "description": "Plan schema version. Bumped on breaking changes.",
      "enum": [1]
    },
    "generated_at": {
      "type": "string",
      "description": "ISO-8601 timestamp when the routine wrote this plan."
    },
    "regime_hint": {
      "type": "object",
      "description": "Claude's read on macro/market regime for the day.",
      "additionalProperties": false,
      "properties": {
        "direction": { "type": "string", "enum": ["TRENDING_UP", "TRENDING_DOWN", "RANGING", "UNKNOWN"] },
        "volatility": { "type": "string", "enum": ["LOW", "NORMAL", "HIGH", "EXTREME"] },
        "notes": { "type": "string", "maxLength": 1000 }
      }
    },
    "risk_overrides": {
      "type": "object",
      "description": "Runtime caps for today. Bot clamps to settings.py caps; never loosens them. NOTE: max_trades is NOT overridable here — it is fixed by settings.MAX_TRADES_PER_DAY.",
      "additionalProperties": false,
      "properties": {
        "risk_per_trade_pct": { "type": "number", "minimum": 0.1, "maximum": 5.0 },
        "max_open_positions": { "type": "integer", "minimum": 0, "maximum": 5 }
      }
    },
    "watchlist": {
      "type": "array",
      "description": "Up to 10 symbols Claude picked for today, with per-symbol bias.",
      "minItems": 1,
      "maxItems": 10,
      "items": {
        "type": "object",
        "required": ["symbol", "bias", "conviction"],
        "additionalProperties": false,
        "properties": {
          "symbol": {
            "type": "string",
            "pattern": "^[A-Z0-9&\\-]{1,20}$",
            "description": "NSE tradingsymbol (uppercase, 1-20 chars)."
          },
          "bias": {
            "type": "string",
            "enum": ["long", "short", "both", "avoid"],
            "description": "long = only BUY signals; short = only SELL; both = either; avoid = skip entirely."
          },
          "conviction": {
            "type": "integer",
            "minimum": 1,
            "maximum": 5,
            "description": "1 = low conviction, 5 = high. Currently informational; may influence sizing later."
          },
          "notes": {
            "type": "string",
            "maxLength": 500,
            "description": "Free-text rationale: catalyst, levels, what would invalidate."
          }
        }
      }
    },
    "rationale": {
      "type": "string",
      "description": "Short overall rationale. Mirrors the Pre-Market journal section.",
      "maxLength": 4000
    },
    "lessons_applied": {
      "type": "array",
      "description": "Prior-day #lesson tags this plan is applying.",
      "items": { "type": "string", "maxLength": 300 },
      "maxItems": 20
    }
  }
}
